{
  "title": "Contact Form",
  "fields": [
    { "name": "name", "label": "Name", "type": "text", "placeholder": "Your name", "required": true },
    { "name": "email", "label": "Email", "type": "email", "placeholder": "you@example.com", "required": true },
    { "name": "message", "label": "Message", "type": "textarea", "placeholder": "Your message..." }
  ],
  "submitLabel": "Submit",
  "successMessage": "Thank you! Your message has been sent."
}
